{
  "id": "ark-to-jerusalem",
  "title": {
    "ru": "Перенесение ковчега в Иерусалим"
  },
  "kind": "dedication",
  "year": -1000,
  "approx": true,
  "placeIds": [
    "jerusalem"
  ],
  "personIds": [
    "david"
  ],
  "periodId": "united-kingdom",
  "bibleRefs": [
    "2 Цар 6"
  ],
  "note": "из Кириаф-Иарима через дом Аведдара"
}