{
  "id": "call-of-abraham",
  "title": {
    "ru": "Призвание Авраама"
  },
  "kind": "covenant",
  "year": -2091,
  "approx": true,
  "placeIds": [
    "harran"
  ],
  "periodId": "patriarchal",
  "bibleRefs": [
    "Быт 12:1-4"
  ],
  "maps": [
    "avraam"
  ],
  "note": "75 лет Аврааму при выходе из Харрана"
}