{
  "id": "exodus",
  "title": {
    "ru": "Исход из Египта"
  },
  "kind": "exodus-event",
  "year": -1446,
  "placeIds": [
    "rameses",
    "succoth"
  ],
  "periodId": "exodus-conquest",
  "bibleRefs": [
    "Исх 12",
    "3 Цар 6:1"
  ],
  "maps": [
    "ishod"
  ],
  "extraBiblical": "ранняя датировка — позиция сайта (§2-бис)"
}